{
  "$schema": "https://json-schema.org/draft/2020-12/schema",
  "$id": "https://noortrace.example/schemas/v0/manifeste.schema.json",
  "title": "Manifeste de période NOORTRACE, version 0",
  "description": "Le manifeste d'une période horaire d'un journal : bornes de temps et de séquence, nombre d'événements, racine de Merkle RFC 6962, chaînage avec la période précédente, clé de l'enregistreur, nonce. periodHash = SHA-256(\"noortrace/manifeste/v0\\n\" || JCS(manifeste)). La signature Ed25519 du manifeste est portée à côté (manifeste.sig), jamais dedans. Les relations arithmétiques (period_end = period_start + 3600, count = last_seq - first_seq + 1, racine nulle si et seulement si count = 0) sont vérifiées par le vérificateur.",
  "type": "object",
  "additionalProperties": false,
  "required": [
    "version", "org_id", "journal_id", "period_start", "period_end", "first_seq", "last_seq",
    "count", "root", "prev_period_hash", "recorder_key_id", "nonce", "generated_at"
  ],
  "properties": {
    "version": { "const": 0 },
    "org_id": { "$ref": "#/$defs/hex32" },
    "journal_id": { "$ref": "#/$defs/hex32" },
    "period_start": {
      "type": "integer",
      "minimum": 0,
      "maximum": 9007199254740991,
      "multipleOf": 3600,
      "description": "Début de la période, secondes UNIX, heure UTC pleine (inclus)."
    },
    "period_end": {
      "type": "integer",
      "minimum": 3600,
      "maximum": 9007199254740991,
      "multipleOf": 3600,
      "description": "Fin de la période, secondes UNIX, heure UTC pleine (exclue) : period_start + 3600."
    },
    "first_seq": { "type": "integer", "minimum": 1, "maximum": 9007199254740991 },
    "last_seq": {
      "type": "integer",
      "minimum": 0,
      "maximum": 9007199254740991,
      "description": "Dernier seq de la période ; first_seq - 1 pour une période vide."
    },
    "count": { "type": "integer", "minimum": 0, "maximum": 9007199254740991 },
    "root": {
      "$ref": "#/$defs/hex32",
      "description": "Racine de Merkle RFC 6962 des hash des événements de la période ; 32 octets nuls pour une période vide (convention NOORTRACE imposée par PeriodRegistry)."
    },
    "prev_period_hash": {
      "$ref": "#/$defs/hex32",
      "description": "periodHash de la période précédente du même journal ; 32 octets nuls pour la première période."
    },
    "recorder_key_id": { "type": "string", "pattern": "^[A-Za-z0-9][A-Za-z0-9._-]{0,63}$" },
    "nonce": { "$ref": "#/$defs/hex32", "description": "32 octets aléatoires : deux clôtures d'une même heure n'ont jamais la même empreinte." },
    "generated_at": {
      "type": "string",
      "pattern": "^[0-9]{4}-(0[1-9]|1[0-2])-(0[1-9]|[12][0-9]|3[01])T([01][0-9]|2[0-3]):[0-5][0-9]:[0-5][0-9]\\.[0-9]{3}Z$",
      "description": "Instant de production du manifeste, RFC 3339 UTC à trois décimales ; la date doit exister dans le calendrier grégorien proleptique (CT-1 §3)."
    }
  },
  "allOf": [
    {
      "if": { "properties": { "count": { "const": 0 } } },
      "then": { "properties": { "root": { "const": "0x0000000000000000000000000000000000000000000000000000000000000000" } } },
      "else": { "properties": { "root": { "not": { "const": "0x0000000000000000000000000000000000000000000000000000000000000000" } } } }
    }
  ],
  "$defs": {
    "hex32": { "type": "string", "pattern": "^0x[0-9a-f]{64}$" }
  }
}
