{
  "version": 0,
  "org_id": "0xa581bb78871a286f5e48b72433a4440c04303db610387e877d730ddb0366daab",
  "journal_id": "0x41c240366d993e0f2a4031f7177f26cb33a68f87652b51e0979dd863f21c5164",
  "period_start": 1793872800,
  "period_end": 1793876400,
  "first_seq": 10,
  "last_seq": 13,
  "count": 4,
  "root": "0x430b9b166c2ce89312203fd402d324671b76737524d0f59d8e137d5d4e3e1d03",
  "prev_period_hash": "0xae22426f25529379efab196ba8b5f73c4729b27d8fca4409a26d803848860914",
  "recorder_key_id": "rec-test-02",
  "nonce": "0xa57b8896278fbd10b1e209de387295d6a5d2137e6f64a1f534b0e60129be9168",
  "generated_at": "2026-11-05T11:00:00.212Z"
}
